{
  "schemaVersion": "1.0.0",
  "catalogVersion": 7,
  "assetRoots": [
    {
      "id": "sites-public",
      "basePath": "apps/sites-lite/public/assets"
    }
  ],
  "assets": [
    {
      "id": "card-unwritten-page-front",
      "contentVersion": 2,
      "status": "available",
      "kind": "card-front",
      "defaultVariantId": "display-local",
      "variants": [
        {
          "id": "display-local",
          "usage": "display",
          "mimeType": "image/webp",
          "width": 1024,
          "height": 1536,
          "source": {
            "type": "local",
            "rootId": "sites-public",
            "path": "cards/unwritten-page/front.webp"
          },
          "byteSize": 446952,
          "sha256": "ca8a8911b844780e559f0e8b4e42f15b79984640ad27867175c03db06fe28711"
        },
        {
          "id": "original-remote",
          "usage": "original",
          "mimeType": "image/png",
          "width": 2048,
          "height": 3072,
          "source": {
            "type": "object-storage",
            "provider": "s3-compatible",
            "connectionId": "cards-production",
            "bucket": "infinity-arcana-assets",
            "objectKey": "knowledge-arcana-vol-1/cards/unwritten-page/front.png",
            "access": "signed"
          }
        }
      ]
    },
    {
      "id": "card-scribe-of-all-things-front",
      "contentVersion": 2,
      "status": "available",
      "kind": "card-front",
      "defaultVariantId": "display-local",
      "variants": [
        {
          "id": "display-local",
          "usage": "display",
          "mimeType": "image/webp",
          "width": 1024,
          "height": 1536,
          "source": {
            "type": "local",
            "rootId": "sites-public",
            "path": "cards/scribe-of-all-things/front.webp"
          },
          "byteSize": 502014,
          "sha256": "1772db56a9e1f7a3e5ea8a137c5ad7a4603f363be0d55278f19746cfbb0cf1dd"
        },
        {
          "id": "original-remote",
          "usage": "original",
          "mimeType": "image/png",
          "width": 2048,
          "height": 3072,
          "source": {
            "type": "object-storage",
            "provider": "s3-compatible",
            "connectionId": "cards-production",
            "bucket": "infinity-arcana-assets",
            "objectKey": "knowledge-arcana-vol-1/cards/scribe-of-all-things/front.png",
            "access": "signed"
          }
        }
      ]
    },
    {
      "id": "card-babel-library-front",
      "contentVersion": 3,
      "status": "available",
      "kind": "card-front",
      "defaultVariantId": "display-local",
      "variants": [
        {
          "id": "display-local",
          "usage": "display",
          "mimeType": "image/webp",
          "width": 1024,
          "height": 1536,
          "source": {
            "type": "local",
            "rootId": "sites-public",
            "path": "cards/babel-library/front.webp"
          },
          "byteSize": 585566,
          "sha256": "da4d003b9933a4da3ff2bd686c5ccdb2531d2c4a7df9069da90558b4fdc4d0a9"
        },
        {
          "id": "original-remote",
          "usage": "original",
          "mimeType": "image/png",
          "width": 2048,
          "height": 3072,
          "source": {
            "type": "object-storage",
            "provider": "s3-compatible",
            "connectionId": "cards-production",
            "bucket": "infinity-arcana-assets",
            "objectKey": "knowledge-arcana-vol-1/cards/babel-library/front.png",
            "access": "signed"
          }
        }
      ]
    },
    {
      "id": "card-orchard-of-stories-front",
      "contentVersion": 2,
      "status": "available",
      "kind": "card-front",
      "defaultVariantId": "display-local",
      "variants": [
        {
          "id": "display-local",
          "usage": "display",
          "mimeType": "image/webp",
          "width": 1024,
          "height": 1536,
          "source": {
            "type": "local",
            "rootId": "sites-public",
            "path": "cards/orchard-of-stories/front.webp"
          },
          "byteSize": 570614,
          "sha256": "4b49635c2d3a36e6c39365f5a399f7267d8c52645abd36923c17f78a9720055d"
        },
        {
          "id": "original-remote",
          "usage": "original",
          "mimeType": "image/png",
          "width": 2048,
          "height": 3072,
          "source": {
            "type": "object-storage",
            "provider": "s3-compatible",
            "connectionId": "cards-production",
            "bucket": "infinity-arcana-assets",
            "objectKey": "knowledge-arcana-vol-1/cards/orchard-of-stories/front.png",
            "access": "signed"
          }
        }
      ]
    },
    {
      "id": "card-first-catalogue-front",
      "contentVersion": 2,
      "status": "available",
      "kind": "card-front",
      "defaultVariantId": "display-local",
      "variants": [
        {
          "id": "display-local",
          "usage": "display",
          "mimeType": "image/webp",
          "width": 1024,
          "height": 1536,
          "source": {
            "type": "local",
            "rootId": "sites-public",
            "path": "cards/first-catalogue/front.webp"
          },
          "byteSize": 537188,
          "sha256": "9ab016f793ac4d54907bfa67728133b2ac1a0a65002eb639f13a20c1bde85acf"
        },
        {
          "id": "original-remote",
          "usage": "original",
          "mimeType": "image/png",
          "width": 2048,
          "height": 3072,
          "source": {
            "type": "object-storage",
            "provider": "s3-compatible",
            "connectionId": "cards-production",
            "bucket": "infinity-arcana-assets",
            "objectKey": "knowledge-arcana-vol-1/cards/first-catalogue/front.png",
            "access": "signed"
          }
        }
      ]
    },
    {
      "id": "card-millennial-lecture-hall-front",
      "contentVersion": 2,
      "status": "available",
      "kind": "card-front",
      "defaultVariantId": "display-local",
      "variants": [
        {
          "id": "display-local",
          "usage": "display",
          "mimeType": "image/webp",
          "width": 1024,
          "height": 1536,
          "source": {
            "type": "local",
            "rootId": "sites-public",
            "path": "cards/millennial-lecture-hall/front.webp"
          },
          "byteSize": 564908,
          "sha256": "51945e3578a7f7b6f9b5d4afba0c821f727290eaaee949ecf47ebb3a6c5ef304"
        },
        {
          "id": "original-remote",
          "usage": "original",
          "mimeType": "image/png",
          "width": 2048,
          "height": 3072,
          "source": {
            "type": "object-storage",
            "provider": "s3-compatible",
            "connectionId": "cards-production",
            "bucket": "infinity-arcana-assets",
            "objectKey": "knowledge-arcana-vol-1/cards/millennial-lecture-hall/front.png",
            "access": "signed"
          }
        }
      ]
    },
    {
      "id": "card-twin-variant-texts-front",
      "contentVersion": 2,
      "status": "available",
      "kind": "card-front",
      "defaultVariantId": "display-local",
      "variants": [
        {
          "id": "display-local",
          "usage": "display",
          "mimeType": "image/webp",
          "width": 1024,
          "height": 1536,
          "source": {
            "type": "local",
            "rootId": "sites-public",
            "path": "cards/twin-variant-texts/front.webp"
          },
          "byteSize": 518720,
          "sha256": "156a40b41c8f37de8d64a4ed64cfe7c47581bb02df455459e0f697e79458f6b3"
        },
        {
          "id": "original-remote",
          "usage": "original",
          "mimeType": "image/png",
          "width": 2048,
          "height": 3072,
          "source": {
            "type": "object-storage",
            "provider": "s3-compatible",
            "connectionId": "cards-production",
            "bucket": "infinity-arcana-assets",
            "objectKey": "knowledge-arcana-vol-1/cards/twin-variant-texts/front.png",
            "access": "signed"
          }
        }
      ]
    },
    {
      "id": "card-roaming-grand-library-front",
      "contentVersion": 2,
      "status": "available",
      "kind": "card-front",
      "defaultVariantId": "display-local",
      "variants": [
        {
          "id": "display-local",
          "usage": "display",
          "mimeType": "image/webp",
          "width": 1024,
          "height": 1536,
          "source": {
            "type": "local",
            "rootId": "sites-public",
            "path": "cards/roaming-grand-library/front.webp"
          },
          "byteSize": 555730,
          "sha256": "b8086b006fd8af4e5015997b3aef28564769a150331c760647eae44f8c3b0fa2"
        },
        {
          "id": "original-remote",
          "usage": "original",
          "mimeType": "image/png",
          "width": 2048,
          "height": 3072,
          "source": {
            "type": "object-storage",
            "provider": "s3-compatible",
            "connectionId": "cards-production",
            "bucket": "infinity-arcana-assets",
            "objectKey": "knowledge-arcana-vol-1/cards/roaming-grand-library/front.png",
            "access": "signed"
          }
        }
      ]
    },
    {
      "id": "card-compiler-of-beast-tongues-front",
      "contentVersion": 2,
      "status": "available",
      "kind": "card-front",
      "defaultVariantId": "display-local",
      "variants": [
        {
          "id": "display-local",
          "usage": "display",
          "mimeType": "image/webp",
          "width": 1024,
          "height": 1536,
          "source": {
            "type": "local",
            "rootId": "sites-public",
            "path": "cards/compiler-of-beast-tongues/front.webp"
          },